{
  "workflow_id": "wf_7Kq2",
  "name": "Support ticket triage",
  "window_days": 30,
  "executions_sampled": 200,
  "collected_at": "2026-09-12T12:50:00Z",
  "nodes": [
    {
      "id": "n_classify",
      "name": "Classify ticket",
      "type": "@n8n/n8n-nodes-langchain.chainLlm",
      "model": "openai/gpt-5",
      "calls": 200,
      "prompt_tokens_avg": 1840,
      "completion_tokens_avg": 6,
      "distinct_outputs": 4,
      "output_samples": [
        "billing",
        "technical",
        "account",
        "other"
      ],
      "latency_p50_ms": 2100,
      "latency_p95_ms": 4300,
      "cost_est_month_eur": 412.0
    },
    {
      "id": "n_draft",
      "name": "Draft reply",
      "type": "@n8n/n8n-nodes-langchain.chainLlm",
      "model": "openai/gpt-5",
      "calls": 200,
      "prompt_tokens_avg": 3200,
      "completion_tokens_avg": 180,
      "distinct_outputs": 197,
      "output_samples": [
        "Bonjour, merci pour votre message...",
        "Hello, thanks for reaching out..."
      ],
      "latency_p50_ms": 3800,
      "latency_p95_ms": 7200,
      "cost_est_month_eur": 890.0
    }
  ]
}